{"$id":"https://github.com/lanly-dev/mager/blob/main/spec/map-spec.schema.json","$schema":"http://json-schema.org/draft-07/schema#","additionalProperties":false,"description":"Game-agnostic map description. Generic core fields plus per-game profiles. Coordinates are world units with the origin at the map center (x right, z down-screen); y is up.","properties":{"bases":{"items":{"additionalProperties":false,"properties":{"faction":{"type":"string"},"radius":{"exclusiveMinimum":0,"type":"number"},"x":{"type":"number"},"z":{"type":"number"}},"required":["x","z","radius"],"type":"object"},"type":"array"},"heightfield":{"additionalProperties":false,"allOf":[{"if":{"properties":{"mode":{"const":"parameterized"}}},"then":{"required":["seed"]}},{"if":{"properties":{"mode":{"const":"explicit"}}},"then":{"required":["png","minHeight","maxHeight"]}}],"properties":{"craters":{"items":{"additionalProperties":false,"properties":{"depth":{"minimum":0,"type":"number"},"radius":{"exclusiveMinimum":0,"type":"number"},"rimHeight":{"minimum":0,"type":"number"},"x":{"type":"number"},"z":{"type":"number"}},"required":["x","z","radius","depth"],"type":"object"},"type":"array"},"gain":{"exclusiveMinimum":0,"maximum":1,"type":"number"},"heightScale":{"exclusiveMinimum":0,"type":"number"},"lacunarity":{"exclusiveMinimum":0,"type":"number"},"maxHeight":{"type":"number"},"minHeight":{"type":"number"},"mode":{"enum":["parameterized","explicit"]},"octaves":{"maximum":12,"minimum":1,"type":"integer"},"png":{"minLength":1,"type":"string"},"resolution":{"minimum":16,"type":"integer"},"seed":{"type":"integer"}},"required":["mode"],"type":"object"},"materials":{"additionalProperties":false,"properties":{"palette":{"items":{"additionalProperties":false,"properties":{"color":{"pattern":"^#[0-9a-fA-F]{6}$","type":"string"},"id":{"minimum":0,"type":"integer"},"label":{"type":"string"}},"required":["id","label","color"],"type":"object"},"type":"array"},"splatmapPng":{"minLength":1,"type":"string"}},"type":"object"},"meta":{"additionalProperties":false,"properties":{"author":{"type":"string"},"name":{"minLength":1,"type":"string"},"seed":{"type":"integer"},"spec":{"const":"mager-map"},"version":{"const":1}},"required":["spec","version","name","seed"],"type":"object"},"profiles":{"additionalProperties":true,"description":"Game-specific extensions. Anything only one game needs lives here, not in core.","properties":{"rts":{"additionalProperties":false,"properties":{"biome":{"enum":["verdant","arid"]},"layer":{"const":"surface"}},"type":"object"}},"type":"object"},"resources":{"items":{"additionalProperties":false,"properties":{"kind":{"minLength":1,"type":"string"},"reserve":{"minimum":0,"type":"number"},"x":{"type":"number"},"z":{"type":"number"}},"required":["kind","x","z","reserve"],"type":"object"},"type":"array"},"scenery":{"additionalProperties":false,"properties":{"clearRadius":{"minimum":0,"type":"number"},"density":{"maximum":1,"minimum":0,"type":"number"},"propSet":{"type":"string"},"seed":{"type":"integer"}},"type":"object"},"world":{"additionalProperties":false,"properties":{"depth":{"exclusiveMinimum":0,"type":"number"},"width":{"exclusiveMinimum":0,"type":"number"}},"type":"object"}},"required":["meta","heightfield","resources","bases"],"title":"MAGER map spec","type":"object"}