{"bases":[{"faction":"west","radius":40.0,"x":-200.0,"z":0.0},{"faction":"east","radius":40.0,"x":200.0,"z":0.0}],"heightfield":{"craters":[{"depth":12.0,"radius":60.0,"rimHeight":4.0,"x":-80.0,"z":40.0},{"depth":9.0,"radius":45.0,"rimHeight":3.0,"x":90.0,"z":-70.0}],"gain":0.5,"lacunarity":2.0,"mode":"parameterized","octaves":4,"resolution":128,"seed":12345},"materials":{"palette":[{"color":"#4CAF50","id":0,"label":"Grass"},{"color":"#8D6E63","id":1,"label":"Rock"},{"color":"#D7CCC8","id":2,"label":"Sand"}]},"meta":{"author":"mager","name":"bowl-01","seed":12345,"spec":"mager-map","version":1},"profiles":{"rts":{"biome":"verdant","layer":"surface"}},"resources":[{"kind":"metal","reserve":2400,"x":-120.0,"z":-60.0},{"kind":"metal","reserve":2400,"x":120.0,"z":60.0},{"kind":"energy","reserve":2400,"x":-100.0,"z":80.0},{"kind":"energy","reserve":2400,"x":100.0,"z":-80.0},{"kind":"oil","reserve":2400,"x":0.0,"z":-140.0},{"kind":"oil","reserve":2400,"x":0.0,"z":140.0}],"scenery":{"clearRadius":60.0,"density":0.5,"propSet":"default","seed":12345},"world":{"depth":600,"width":600}}